{
  "$schema": "http://json-schema.org/draft-07/schema#",
  "title": "QIT Test Package Schema",
  "description": "Schema for QIT test package manifest files",
  "type": "object",
  "required": ["$schema", "test_type"],
  "additionalProperties": false,
  "properties": {
    "$schema": {
      "type": "string",
      "const": "https://qit.woo.com/json-schema/test-package",
      "description": "Schema reference for IDE support"
    },
    "tags": {
      "type": "array",
      "description": "Tags for categorizing and searching test packages",
      "items": {
        "type": "string",
        "pattern": "^[a-zA-Z0-9_-]+$"
      },
      "uniqueItems": true
    },
    "test_type": {
      "type": "string",
      "description": "Type of test (e.g., e2e, unit, integration, security)",
      "pattern": "^[a-zA-Z0-9_-]+$"
    },
    "test_dir": {
      "type": "string",
      "description": "Directory containing test files",
      "pattern": "^\\./.*$"
    },
    "description": {
      "type": "string",
      "description": "Human-readable description of what this test package does",
      "maxLength": 500
    },
    "requires": {
      "type": "object",
      "description": "Requirements for running this test package",
      "additionalProperties": false,
      "properties": {
        "plugins": {
          "type": "object",
          "description": "Required plugins with version constraints",
          "patternProperties": {
            "^[a-zA-Z0-9_-]+$": {
              "type": "string",
              "description": "Semantic version constraint (e.g., ^9.8.0, >=6.0.0)"
            }
          },
          "additionalProperties": false
        },
        "themes": {
          "type": "object",
          "description": "Required themes with version constraints",
          "patternProperties": {
            "^[a-zA-Z0-9_-]+$": {
              "type": "string",
              "description": "Semantic version constraint"
            }
          },
          "additionalProperties": false
        },
        "wordpress": {
          "type": "string",
          "description": "WordPress version constraint"
        },
        "php": {
          "type": "string",
          "description": "PHP version constraint"
        },
        "secrets": {
          "type": "array",
          "description": "Required environment secrets/API keys",
          "items": {
            "type": "string",
            "pattern": "^[A-Z_][A-Z0-9_]*$"
          },
          "uniqueItems": true
        },
        "external_services": {
          "type": "array",
          "description": "External services needed (for documentation purposes)",
          "items": {
            "type": "string"
          },
          "uniqueItems": true
        }
      }
    },
    "lifecycle": {
      "type": "object",
      "additionalProperties": false,
      "properties": {
        "global": {
          "type": "object",
          "description": "Commands that run ONCE per qit run; DB snapshot is taken after .setup",
          "additionalProperties": false,
          "properties": {
            "setup":    { "$ref": "#/definitions/lifecycleCommands" },
            "teardown": { "$ref": "#/definitions/lifecycleCommands" }
          }
        },
        "test": {
          "type": "object",
          "description": "Hooks that execute for every test‑package invocation",
          "additionalProperties": false,
          "allOf": [
            { "anyOf": [ { "required": ["setup"] }, { "required": ["run"] } ] }
          ],
          "properties": {
            "setup":    { "$ref": "#/definitions/lifecycleCommands" },
            "run":      { "$ref": "#/definitions/lifecycleCommands" },
            "teardown": { "$ref": "#/definitions/lifecycleCommands" }
          }
        }
      },
      "required": ["global", "test"]
    },
    "test_results": {
      "type": "object",
      "description": "Test result output configuration",
      "patternProperties": {
        "^[a-zA-Z0-9_-]+$": {
          "type": "string",
          "description": "Path to result file for this format"
        }
      },
      "additionalProperties": false
    },
    "mu_plugins": {
      "type": "array",
      "description": "Must-use plugins to install",
      "items": {
        "type": "string",
        "description": "Path to mu-plugin file"
      }
    },
    "env_vars": {
      "type": "object",
      "description": "Environment variables to set during test execution",
      "additionalProperties": {
        "type": ["string", "boolean", "number"],
        "description": "Environment variable value"
      }
    },
    "timeout": {
      "type": "integer",
      "description": "Test timeout in seconds",
      "minimum": 1,
      "maximum": 3600
    },
    "retry": {
      "type": "object",
      "description": "Retry configuration for flaky tests",
      "additionalProperties": false,
      "properties": {
        "times": {
          "type": "integer",
          "description": "Number of retry attempts",
          "minimum": 0,
          "maximum": 5
        },
        "delay": {
          "type": "integer",
          "description": "Delay between retries in seconds",
          "minimum": 0,
          "maximum": 60
        }
      }
    }
  },
  "definitions": {
    "lifecycleCommands": {
      "type": "array",
      "description": "Array of commands to execute",
      "items": {
        "oneOf": [
          {
            "type": "string",
            "description": "Simple command string (execution context determined by command type)"
          },
          {
            "type": "object",
            "description": "Command with explicit configuration",
            "required": ["command"],
            "additionalProperties": false,
            "properties": {
              "command": {
                "type": "string",
                "description": "Command to execute",
                "minLength": 1
              },
              "runs_on": {
                "type": "string",
                "enum": ["host", "docker"],
                "description": "Where to execute this command (default: smart detection)"
              },
              "timeout": {
                "type": "integer",
                "description": "Command timeout in seconds",
                "minimum": 1,
                "maximum": 3600
              },
              "continue_on_error": {
                "type": "boolean",
                "description": "Continue execution even if this command fails",
                "default": false
              },
              "env": {
                "type": "object",
                "description": "Additional environment variables for this command",
                "additionalProperties": {
                  "type": "string"
                }
              }
            }
          }
        ]
      }
    }
  }
}