{
    "$schema": "https:\/\/qit.woo.com\/json-schema\/test-package",
    "test_type": "integration",
    "test_dir": ".\/src\/tests",
    "test_results": {
        "junit": ".\/output\/junit.xml",
        "coverage": ".\/output\/coverage\/index.html"
    },
    "mu_plugins": [
        ".\/plugins\/helper.php",
        ".\/plugins\/mocks.php"
    ]
}
